index,Unnamed: 0,content,entity,true_score,new_score,raw_score
3453,1286,特变电工(600089)特高压领域领军企业中国的特高压交流输电标准，已经被确定为国际标准，显示出我国在特高压领域的领先地位，而特变电工作为中国变压器行业首家上市公司，目前已发展为中国最大的变压器、电线电缆研发、制造和出口基地，并为特高压产业发展作出巨大贡献,特变电工,1,1,1
3463,1287,二级市场上，伊利股份已经连续9年上涨，今年以来，该股上涨34.32%，足足跑赢3.68倍(上证指数年内涨7.34%).伊利股份业绩连增4年股价连涨9年在伊利集团的展厅内，最惹人注目的是近几年的业绩变化柱形图，如同拾级而上的台阶,伊利股份,1,1,1
3466,1288,2009年伊利股份狂涨231.00%，当年上证指数上涨79.98%；2010年、2011年，上证指数依次下跌14.31%、21.68%，伊利股份逆市上涨44.49%、6.77%；2012年，伊利股份稳步上涨8.77%，同样跑赢上证指数3.17%的涨幅；2013年，上证指数下跌6.75%，而伊利股份大涨79.56%；2014年、2015年，伊利股份依次上涨12.56%、16.92%，同期上证指数依次上涨52.87%、9.41%；2016年，上证指数下跌12.31%，伊利股份再度逆市上涨10.35%；2017年以来，伊利股份上涨34.32%，远远跑赢上证指数7.34%的涨幅,伊利股份,1,6,1
3469,1289,数据显示，2016年全年，在所有披露调研信息的上市公司中，伊利股份获得了高达119次的最多次数调研，时间跨度从当年1月8日延续至12月20日，其中、大摩等海外投行明显给予了最多关注，有67家参与了调研，公募基金方面，南方、广发、华安等31家参与了调研，私募基金有朱雀、景林、博道等8家机构前往调研,伊利股份,1,1,1
3509,1290,'华夏幸福发布声明称，近期，我司注意到个别文章对华夏幸福的经营情况做了相关不实报道，现就相关情况做出如下说明：一、华夏幸福的经营状况稳健良好，相关“银行停止开发贷”等系列报道完全不符合事实，纯属造谣,华夏幸福,1,2,1
3519,1291,另外，索菲亚、、等白马成长股也榜上有名，说明这些股未来的高成长性仍然被机构看好；榜单中也不乏受益于供给侧改革而业绩大增的个股，如、，或许也从侧面说明供给侧改革未来可能还会是A股重要的投资机会,索菲亚,1,2,1
3533,1292,对于机构扎堆看好、昨日市场表现突出且受到资金追捧的山东黄金，表示：在2017年全国黄金总产量下降的背景下，公司产量的逆势上行进一步巩固了行业龙头地位,山东黄金,1,1,1
3539,1293,海通证券首席经济学家姜超提醒称，未来应该转向真正安全和提高效率的资产，而远离一切泡沫资产,海通证券,0,0,1
3583,1294,其中，对于近期成功更名的三六零，也是采取借壳上市的方式，而原来的江南嘉捷股票，也实现了乌鸦变凤凰的神话,江南嘉捷,1,1,1
3585,1295,除证券外，中泰证券、、、天风证券等机构也纷纷表示看好中国巨石后市表现,中国巨石,1,1,1
3594,1296,从季度环比变化来看，工商银行、、、和持股市值环比提升较大,工商银行,1,1,1
3614,1297,而当初顶着“最贵新股”光环上市的步长制药，最终却成为新规后首个跌破发行价的个股，其背后的真实原因，一方面是上市后业绩增速下滑，最新季报显示公司前三季归属于上市公司股东的净利润11.30亿元，同比下降10.2%；另一方面，巨额的解禁，则是导致近期走势承压的主要原因,步长制药,-1,0,1
3642,1298,增资完成后，步长制药将持有11.538%的股权，成为快方送药的第四大股东,步长制药,1,1,1
3648,1299,本周中国银行保险监督管理委员会主要领导班子确定，有利于保证监管政策的一致性，提高监管效率，金融风险有望得到进一步缓释，后续须关注资管新规以及细则，目前看资管新规存在宽限期，对市场的影响可控,中国银行,0,0,1
3649,1300,本周中国银行保险监督管理委员会主要领导班子确定，郭树清成为首任主席,中国银行,0,0,1
3664,1301,总而言之，互联网金融和服务业务正在成为平安集团“加速获客”的主要手段，并且通过这一途径转化的新增客户，对传统金融产品具有较强的购买意愿和渗透率，这意味着互联网金融和服务业务将成为中国平安业绩保持高增长的“新引擎”,中国平安,1,1,1
3666,1302,具体来看，今年一季度，基金持有中国平安41276.74万股，二季度持股数量增至75797.22万股，三季度持仓数量有所下降，但仍达到68117.03万股，持股市值方面，截至三季度末，基金持有中国平安股票参考市值达到368.92亿元,中国平安,1,1,1
3668,1303,(吴珊)农业银行(601288)资产质量大幅改善在社保基金连续3个季度持仓的397只个股中，农业银行社保基金持股数量为979705.88万股(期间持股数量均未发生变化)，以三季度末收盘价计算，持股市值达到374.25亿元，持股市值位居社保基金连续3个季度持仓股中首位,农业银行,1,1,1
3671,1304,具体来看，截至三季度末，险资持有中国人寿股份数量达到193.24亿股，持股市值为5360.35亿元,中国人寿,0,1,1
3673,1305,基本面上，公司已发展为控股型集团上市公司，共控股7家专业制药子公司，2家医药销售子公司，3家医药配套子公司，2家高端保健品公司，1家公路建设收费公司及参股广发证券、通钢集团敦化塔东矿业有限责任公司,广发证券,0,4,1
3675,1306,具体来看，一季度，QFII持有北京银行股份数量达到20.75亿股，截至三季度末，持股数量增至24.90亿股，持股市值方面，截至三季度末，QFII持有北京银行股票参考市值达到185.72亿元,北京银行,1,2,1
3677,1307,港股通昨日也仅28只上涨，多达275只下跌，其中南京熊猫电子股以15.76%的涨幅居于首位，恒发洋参、天成国际和恒腾网络则分别上涨了7.95%、4.35%和3.70%,南京熊猫,1,1,1
3687,1308,对于作者提出“獐子岛扇贝可能大量迁徙到日本北海道”的说法，獐子岛相关人士予以坚决否认,獐子岛,0,1,1
3691,1309,2018年前2月累计销量达117.3万辆，同比增长11.6%，同期行业增速为2.1%，上汽集团作为市场龙头仍然实现稳健增长,上汽集团,1,1,1
3693,1310,但相比海内外零部件巨头15-20倍估值，华域汽车估值有明显折价,华域汽车,-1,1,1
3726,1311,我们在破产清算估值方法的基础上，再给一个溢价，可以大致得出乐视网的合理估值,乐视网,0,1,1
3729,1312,乐视部分业务可以持续经营，当前市场给乐视网的估值是1.62倍PB，因此乐视网的合理估值应该是2.7元,乐视网,1,1,1
3735,1313,作为优秀国产品牌，公司与万科、恒大等大型地产商合作紧密，在地产商采购涂料份额中占比突出,万科,1,2,1
3744,1314,或许是看到齐星铁塔主业发展无碍且逐步企稳，国盛证券毫不犹豫进驻，成为其第一大股东，持股超过齐星集团,齐星铁塔,1,1,1
3764,1315,市场表现、年报预告业绩均表现突出的鲁西化工，后市走势受到机构的普遍看好，近30日内机构“买入”或“增持”等看好评级家数达到5家,鲁西化工,1,1,1
3778,1316,利尔化学股价从业绩快报发布后一路上行，累计上涨35.51%,利尔化学,1,1,1
3781,1317,宝武集团旗下的四合源基金以及重庆政府背景的重庆战略性新兴产业投资基金联合组建的长寿钢铁则通过提供1亿流动资金，不低于39亿购买铁前资产，不超过6%年向公司提供流动资金以及5年内不向除宝武集团外第三方转移股权为条件获得了重整后重庆钢铁控股股东的地位,重庆钢铁,1,1,1
3790,1318,陕西煤业的股票增持，不以谋求实际控制权为目的，也不会导致公司控股股东及实际控制人发生变化,陕西煤业,1,1,1
3794,1319,根据我们统计2017年三季度末至四季度末金禾实业产品中27.5%双氧水产品价格由850元/吨上涨至1800元/吨，涨幅高达117.8%；合成氨产品价格由2570元/吨上涨至3330元/吨，涨幅29.57%；浓硝酸产品价格由1600元/吨涨至2020元/吨，涨幅高达26.25%,金禾实业,1,1,1
3795,1320,根据百川资讯统计，2017年三季度末至四季度末金禾实业27.5%双氧水产品价格由850元/吨上涨至1800元/吨，涨幅高达117.8%,金禾实业,1,2,1
3811,1321,2016年中国平安实现营业收入7124.5亿元，同比增长14.9%，其中已赚保费、银行业务利息净收入、非保险业务手续费及佣金收入、其他业务收入分别同比增长26.23%、12%、2.6%、53.4%，投资收益同比下降20.43%，保险业务收入的快速增长是推动营收增长的主因,中国平安,1,1,1
3816,1322,2兴业证券：看好大创新重点关注七大板块兴业证券表示，春耕反弹行情窗口仍在，结构上看好大创新,兴业证券,0,4,1
3819,1323,武汉中商预计2017年实现净利润3.6亿元至3.7亿元，较上年同期增长17.5倍-18倍，增幅最高，主要因公司已全额收到拆迁补偿款4.4亿元，该项资产征收拆迁补偿款在2017年度进行收入确认，将增加公司净利润约3.5亿元,武汉中商,1,1,1
3823,1324,深康佳A2017年预计实现净利润49.8亿元至50.8亿元，同比增幅超过50倍，主要因公司转让深圳市康侨佳城置业投资有限公司70%股权产生的收益，实现非经常性损益金额约为50亿元,深康佳,1,1,1
3826,1325,QFII去年四季度还新进了景嘉微57.40万股，增持了江化微,江化微,1,1,1
3830,1326,天风证券研报认为，*ST华菱2017年实现盈利，基本符合证监会规定的“摘帽”要求,ST华菱,1,1,1
3841,1327,据统计，在2015年四季度里，蓝色光标加权均价为15.34元，2016年一季度加权均价为10.11元，以大成蓝筹稳健的持股数量计算，其在蓝色光标上的亏损已达到2.16亿元,蓝色光标,-1,0,1
3845,1328,在四个多月后的12月20日，雷鸣科化终于迎来了复牌，并于复牌当天涨停，成交量创出历史新高，单日成交额超过7亿元,雷鸣科化,1,1,1
3848,1329,在二季度里，雷鸣科化股价最高为17.80元，最低为12.58元，即使以15.19元的中位数算，每股也亏损了4.17元，导致大成基金所持有的1101.71万股浮亏超过4400万元,雷鸣科化,0,1,1
3862,1330,但该执行通知书对皇台酒业后续生产经营活动产生的不利影响较小,皇台酒业,1,2,1
3869,1331,净利润大幅下降背后，是天润数娱部分游戏项目尚未达预期以及公司前次并购重组等费用增加,天润数娱,-1,1,1
3892,1332,其中，华贸物流昨日实现涨停，对于该股，国联证券表示，2017年5月份，通过无偿划转，中国诚通成为公司间接控股股东,华贸物流,1,2,1
3893,1333,预计华贸物流将在新平台下继续整合资源，提高资本运营效率，促进业务板块均衡发展,华贸物流,1,3,1
3904,1334,根据公开资料显示，2017年1-9月，蓝思科技实现营收151.2亿，同比增长41.9%；实现归母净利润8.93亿，同比增长12.39%，保持着较高成长性,蓝思科技,1,1,1
3932,1335,2012-2014年，德豪润达逐步收购了雷士照明27.03%的股权，成为其第一大股东，在LED应用领域建立了较为完善的销售渠道,德豪润达,1,1,1
3947,1336,值得说明的是，数日前，爱建集团的非公开发行股票方案完成，作为该方案唯一的定增方均瑶集团，对爱建集团的持股比例从发行前的12.06%，升至发行后的22.08%，成为爱建集团第一大股东,爱建集团,0,1,1
3961,1337,2015年11月，恒大集团正式对外确认收购中新人寿50%的股权，从而成为第一大股东，中新大东方人寿更名为恒大人寿，此次交易对价高达39.39亿元,大东方,0,0,1
3964,1338,两个方向：1)工业废气：提标改造释放千亿市场空间，技术型标的最先获益，建议关注【龙净环保】、【】,龙净环保,1,1,1
3965,1339,1、toG:1)垂管监测权上收，布点密度增加，叠加，2)供给侧智慧化模式，未来各级政府数据方向投入增加，3)国产化率提升：目前我国环境质量监测设备的国产化率仅约50%，未来国产化率的提升将成为趋势；2、toB:1)制度激励：环境监测数据作为排污许可证发放和环境税征收的重要依据，工业企业主观存在加大监测投入的诉求；2)入园模式：在工业企业集中入园的发展趋势下，目前相对薄弱的园区监测基础和水平有望快速提升，建议关注【聚光科技】、【】、【】,聚光科技,1,1,1
3966,1340,2)工业危废：环境税出台+第二次污染普查，加速供需缺口弥合，市场空间逐步释放，建议关注【中金环境】、【】、【】、【】,中金环境,1,1,1
3978,1341,中金公司认为茅台正在分享中国居民高端酒类消费升级带来的机遇，建议关注贵州茅台零售价3000元以上的超高端酒市场和飞天茅台未来稳定放量和适度提价的可能性,贵州茅台,1,1,1
3980,1342,今年贵州茅台业绩更值得期待，并将其目标价定为870元，略提升其2018-2019年EPS至29.07和35.86元，重申强烈推荐,贵州茅台,1,2,1
3988,1343,京东方苏州智造服务产业园项目通过对原有京东方苏州智造服务工厂进行改造、升级、扩产，提高生产效率，提升产业链价值,京东方,1,3,1
3989,1344,据京东方介绍，智造服务是京东方智慧系统事业的重要业务,京东方,0,1,1
3990,1345,目前京东方已在合肥、苏州、重庆建立三座智造服务工厂，实现了设计制造一体化的智能制造新模式，提供个性化定制服务,京东方,1,1,1
3997,1346,在此前新华保险的开放日上，新华保险董事长兼CEO万峰曾表示，2016年至2017年，新华保险持续坚持战略结构调整，增长方式和发展动能已经实现置换,新华保险,1,1,1
4033,1347,刘淑青表示，乐视网未来将坚定互联网基因和文娱结合的发展方向，并坚信电视业务是乐视网未来发展的基础,乐视网,1,3,1
4035,1348,NBD：过去几年，奥康做的布局挺多的，包括推奥康国际馆、联姻美国时尚运动品牌斯凯奇，目前的效果,奥康国际,1,1,1
4044,1349,建议关注公司逻辑内蒙一机：公司作为地面装备龙头，直接受益于陆军机械化带来的对地面装备的大量需求，同时公司是混改试点，有望受益于集团混合所有制改革的持续推进,内蒙一机,1,2,1
4059,1350,个股建议关注启明星辰,启明星辰,1,1,1
4069,1351,另外，作为白酒行业的龙头企业，贵州茅台预计2017年实现归属于上市公司股东的净利润盈利264.18亿元左右，同比增加58%左右，对于业绩变化的原因，贵州茅台表示，本期业绩预增的主要原因是2017年度本公司产品销量同比上年度增长,贵州茅台,1,1,1
4078,1352,其中，大恒科技的持股比例最高，由徐翔母亲郑素贞持股29.75%，自徐翔被抓以来股价下跌了62.08%,大恒科技,-1,1,1
4100,1353,观察发现，对比该公司此前给出的2017年20%~40%的利润增长预期，老板电器的年度实际增速仅达到了预期下限，与上市以来历年的利润增速相对比，2017年的业绩表现创出了历史最低点，即使是相比之前业绩增速最慢的2011年，2017年的利润增速也是出现几近腰斩的下滑,老板电器,-1,-1,1
4108,1354,业绩同样表现不俗的还有片仔癀，因母公司片仔癀药业公司产品销售增长带动，2017年公司的净利润增速达到了47.45%，近年来公司保持了持续稳定的增长，且增幅在不断抬升中,片仔癀,1,2,1
4116,1355,'（原标题：近40家券商昨开始联网测试深港通11月份通车概率大）\n分析师表示，开通的难点并不存在，只是细节上要不断磨合调试在深交所近日发布细则征求意见并明确时间表后，9月12日深圳市场港股通业务正式开始，与恒生电子合作的近40开始接受测试，预计到9月30日结束首轮连通性测试，10月份开始业务仿真测试,恒生电子,1,1,1
4117,1356,点评：一季度公司扣非维持高增速，多项业务进展良好信维通信发布一季度业绩预告，公司预计一季度实现净利润2.05-2.25亿元，中值为2.15亿元，同比增长5.26%；鉴于公司2018Q1非经常性损益较少，一季度扣非后公司仍保持了高速增长，Q1公司扣非净利润为2-2.2亿元，中值2.1亿元，同比增长48.43%,信维通信,1,1,1
4118,1357,公司核心竞争力在于人、产业整合与企业文化信维通信已发展多年，已从原来的专注手机天线产品进化成围绕射频技术的大客户一体化解决方案平台，公司产品涵盖手机天线、无线充电、连接器与屏蔽件、SAW滤波器、声学多个方面,信维通信,1,1,1
4142,1358,乳业品牌在2016年开始与有赞接触，除了用微信公众号售卖奶制品以外，新希望还在消费者预约下单、提货送货、系统集成等方面拥有定制化的服务,新希望,1,1,1
4149,1359,视觉中国于3月6日收获了逾40家机构的调研，、中信建投、等知名机构云集,视觉中国,1,1,1
4151,1360,、、随后直线攀至涨停，赢时胜也获得拉升，最终以涨停收盘,赢时胜,1,1,1
4160,1361,重点推荐：美年健康(002044)、(300015),美年健康,1,1,1
4182,1362,但毋庸置疑的是，已成为万科第三大股东的恒大的态度很可能决定着万科事件的最终走向,万科,0,1,1
4203,1363,快乐购股东户数下降比例最高，其2017年末股东户数为2.73万户，较三季度末下降41.26%,快乐购,-1,1,1
4208,1364,钢铁股韶钢松山2017年实现盈利25.17亿元，比上年同期增长2381%,韶钢松山,1,1,1
4219,1365,从累计分红金额看，目前有60家公司上市以来分红总额超过了百亿元，5家公司的分红总额超过了千亿元，工商银行上市以来的累计分红已达到了5500.04亿元,工商银行,1,1,1
4227,1366,津膜科技昨日获得3家深圳营业部的追捧，包括银河证券深圳景田证券营业部、世纪证券深圳福虹路证券营业部和深圳益田路免税商务大厦营业部，买入金额在500万元至1100万元之间,津膜科技,1,1,1
4243,1367,根据港交所最新披露数据显示，11月2日平安寿险以6.24港元/股的均价增持H股6558.9万股，持股总数增至60.78亿股，占工商银行H股流通股比例达到7%,工商银行,1,1,1
4246,1368,事实上，整个系都在持续对工商银行H股进行增持，截至到11月6日，平安保险集团、平安寿险、平安资产对工商银行H股合计持股比例已超过20%,工商银行,1,1,1
4252,1369,截至到11月10日，民生银行A股收盘价为8.41元，但今年第三季度末，该股净资产却达到9.89元/股，两者相差明显,民生银行,1,-1,1
4258,1370,截至3月27日收盘，华兰生物全天大涨4.82%，今年以来累计涨幅超过一成,华兰生物,1,2,1
4262,1371,在万年青强势反弹中，机构投资者是主要推手之一,万年青,1,1,1
4270,1372,这4家行业组织分别是中国医药创新促进会、百华协会、中国医疗健康产业投资五十人论坛，以及台湾的生策会,中国医药,0,1,1
4277,1373,然而，经过了这一轮轰轰烈烈的股权之争事件，万科的股票价值却获得了市场的追捧，但同时也加快了万科王石时代的落幕，取而代之的则是进入了万科郁亮的时代,万科,1,1,1
4279,1374,至于万科郁亮时代，则仍然深受王石时代的影响，而全面接棒之后的郁亮，更像是一种辉煌的延续,万科,1,1,1
4286,1375,至于万科业绩的持续高增长，在房地产政策环境与市场环境发生实质性变化的过程中，万科又该如何加快转型，并迎合政策环境的变化，这无疑影响到未来万科的可持续发展过程,万科,1,4,1
4293,1376,这些年来，万科股票在中国资本市场中确实起到了领跑者、引导者的重要角色，并给予了长期投资者非常丰厚的投资回报率,万科,1,1,1
4295,1377,站在当前这个时点，基于以下三点，东吴证券坚定看好保险板块,东吴证券,0,0,1
4318,1378,被调研总数靠前的公司中，大族激光预计2017年度实现净利润为16.22亿元-17.73亿元，同比增长115%-135%；预计2017年度实现净利润为30.03亿元-45.04亿元，同比增长0%-50%,大族激光,1,1,1
4343,1379,作为玻璃行业龙头之一，旗滨集团受惠市场增长对玻璃建材的需求增加，三季报业绩继续今年半年报的高增长,旗滨集团,1,2,1
4349,1380,本周重点推荐个股：【国祯环保】聚焦水处理，多业务布局打造综合环境服务商,国祯环保,1,1,1
4353,1381,九鼎投资核心业务包括参股投资、控股投资、和固定收益投资三大板块，在消费、服务、物流、旅游、文化、农业、装备、材料、化工、能源、矿业、医药、医疗、信息、公用、金融、互联网、不动产等20余个细分行业领域组建有专业投资团队,九鼎投资,1,1,1
4357,1382,从业绩的角度来看，截至昨日，与中国制造2025相关的8家已披露2017年年报的上市公司，报告期内归属母公司净利润均实现同比增长，其中，(804.73%)、(146.80%)两家公司报告期内业绩均实现同比翻番，而沈阳机床则在报告期内实现同比扭亏,沈阳机床,1,1,1
4361,1383,目前私募界最为人津津乐道的一段佳话，便是王亚伟投资，昀沣证券持有三聚环保4年多以来，三聚环保股价累计上涨达到6倍左右,三聚环保,1,2,1
4378,1384,值得一提的是，今日创业板逆势收涨逾1%，同时日线级别走出的孕线形态显示出下行动能明显减弱，收盘站稳了十天均线，不过，目前五天均线仍然下行，加之，反弹的量能虽所放大，特别是创蓝筹等近期持续得到资金增持，因此后市可继续的看多……【】大盘在3200点附近向上的缺口还没有回补，这个缺口没有留下来的理由，最终应该回补，如果今天上涨的保险、中国石化等个股利好兑现，明天或将带动大盘出现跳水，但整体大跌的概率不大，逐步回落向下回补3200点附近缺口的概率较大……【】玉名认为这个阶段就是相对尴尬一些，概念股大幅炒作之后，监管严格了，资金本身的敏感度也高了，操作难度非常大；而价值板块方面，大资金是没有太多出手，所以走势也很难有太大改变,中国石化,1,0,1
4380,1385,其中，柳工2016年净利润实现同比倍增，增幅为131.13%，上海证券预计公司2017年、2018年、2019年销售收入为84.05亿元、95.70亿元、107.43亿元，归属母公司净利润为2.56亿元、4.58亿元、6.45亿元，每股收益为0.23元、0.41元、0.56元，对应的市盈率为39.1倍、21.8倍、15.5倍，公司受益于行业回暖和“一带一路”战略，而且随着销量的回升，公司业绩改善有望超预期，维持公司“增持”评级，预测目标价为11.77元,柳工,1,2,1
4388,1386,关注航发动力、、,航发动力,1,1,1
4412,1387,例如上投摩根核心成长股票在2017年四季度重仓了欧菲科技，欧菲科技为小米生产摄像头,欧菲科技,1,1,1
4414,1388,欧菲科技从2月9日到3月8日股价上涨了5.05元，由此计算，上投摩根核心成长最近一个月在欧菲科技上浮盈1847.86万元,欧菲科技,1,1,1
4424,1389,差距正在缩小昨日，受贵州茅台大幅提价影响，沉寂一时的白酒股掀起一轮波澜壮阔的行情，贵州茅台股价以3.44%涨幅高开，经历短暂调整后，股价一路向上，全天大涨8.21%，其余白酒股也纷纷跟风大涨，上演了“王者归来”的戏码,贵州茅台,1,1,1
4436,1390,王晴表示，双方多次交涉结款并不顺利，新世界百货崇文门店方面相互推诿，活动欠款涉及14个活动，其中3项活动制作合同返回，剩余11项活动合同还押在崇文门店,新世界,-1,1,1
4480,1391,另外，有媒体报道，2月1日，乐视网(300104)迎来复牌以来的第7个跌停，根据保守预估，目前最新股价已经跌穿贾跃亭平仓线,乐视网,-1,1,1
4484,1392,外贸信托新进华建集团所占流通股比例0.2%，成为华建集团第八大股东,华建集团,0,1,1
4485,1393,北京信托新进华铁科技所占流通股比例0.98%，成为华铁科技第七大股东,华铁科技,0,1,1
4512,1394,而目前曲美家居OAO模式引流效果明显，你+及居+生活馆战略继续推进，渠道持续深化，首次推出股票激励计划绑定上下利益、明确发展目标，未来可能会与更多大型地产商合作，大宗业务有望成为公司新的利润增长点,曲美家居,1,1,1
4521,1395,上市公司业绩快报显示，去年中科曙光实现净利润3.05亿元，同比增长超过三成,中科曙光,1,1,1
4533,1396,关键词二：新兴行业成长股中国平安首席投资官陈德贤：我们同时关注具有良好成长性的股票，积极把握新经济领域的投资机会,中国平安,0,3,1
4548,1397,山西证券在自营方面表现尤为出色，实现自营收入13.44亿元，占营收的比重达到了64.03%，同比增长1949%,山西证券,1,1,1
4554,1398,其中，中信证券承销业务实现收入人民币18.44亿元，同比下降37.80%,中信证券,-1,1,1
