,公司代码,公司简称,公司全称,A股代码,A股简称,A股上市日期,城市
225,300228,富瑞特装,张家港富瑞特种装备股份有限公司,300228,富瑞特装,2011年6月8日,江苏苏州市
226,300229,拓尔思,北京拓尔思信息技术股份有限公司,300229,拓尔思,2011年6月15日,北京市
227,300230,永利股份,上海永利带业股份有限公司,300230,永利股份,2011年6月15日,上海市
228,300231,银信科技,北京银信长远科技股份有限公司,300231,银信科技,2011年6月15日,北京市
229,300232,洲明科技,深圳市洲明科技股份有限公司,300232,洲明科技,2011年6月22日,广东深圳市
230,300233,金城医药,山东金城医药化工股份有限公司,300233,金城医药,2011年6月22日,山东淄博市
231,300234,开尔新材,浙江开尔新材料股份有限公司,300234,开尔新材,2011年6月22日,浙江金华市
232,300235,方直科技,深圳市方直科技股份有限公司,300235,方直科技,2011年6月29日,广东深圳市
233,300236,上海新阳,上海新阳半导体材料股份有限公司,300236,上海新阳,2011年6月29日,上海市
234,300237,美晨科技,山东美晨科技股份有限公司,300237,美晨科技,2011年6月29日,山东潍坊市
235,300238,冠昊生物,冠昊生物科技股份有限公司,300238,冠昊生物,2011年7月6日,广东广州市
236,300239,东宝生物,包头东宝生物技术股份有限公司,300239,东宝生物,2011年7月6日,内蒙古包头市
237,300240,飞力达,江苏飞力达国际物流股份有限公司,300240,飞力达,2011年7月6日,江苏苏州市
238,300241,瑞丰光电,深圳市瑞丰光电子股份有限公司,300241,瑞丰光电,2011年7月12日,广东深圳市
239,300242,明家科技,广东明家科技股份有限公司,300242,明家科技,2011年7月12日,广东东莞市
240,300243,瑞丰高材,山东瑞丰高分子材料股份有限公司,300243,瑞丰高材,2011年7月12日,山东淄博市
241,300244,迪安诊断,浙江迪安诊断技术股份有限公司,300244,迪安诊断,2011年7月19日,浙江杭州市
242,300245,天玑科技,上海天玑科技股份有限公司,300245,天玑科技,2011年7月19日,上海市
243,300246,宝莱特,广东宝莱特医用科技股份有限公司,300246,宝莱特,2011年7月19日,广东珠海市
244,300247,乐金健康,安徽乐金健康科技股份有限公司,300247,乐金健康,2011年7月29日,安徽合肥市
245,300248,新开普,新开普电子股份有限公司,300248,新开普,2011年7月29日,河南郑州市
246,300249,依米康,四川依米康环境科技股份有限公司,300249,依米康,2011年8月3日,四川成都市
247,300250,初灵信息,杭州初灵信息技术股份有限公司,300250,初灵信息,2011年8月3日,浙江杭州市
248,300251,光线传媒,北京光线传媒股份有限公司,300251,光线传媒,2011年8月3日,北京市
249,300252,金信诺,深圳金信诺高新技术股份有限公司,300252,金信诺,2011年8月18日,广东深圳市
250,300253,卫宁健康,卫宁健康科技集团股份有限公司,300253,卫宁健康,2011年8月18日,上海市
251,300254,仟源医药,山西仟源医药集团股份有限公司,300254,仟源医药,2011年8月19日,山西大同市
252,300255,常山药业,河北常山生化药业股份有限公司,300255,常山药业,2011年8月19日,河北石家庄市
253,300256,星星科技,浙江星星科技股份有限公司,300256,星星科技,2011年8月19日,浙江台州市
254,300257,开山股份,浙江开山压缩机股份有限公司,300257,开山股份,2011年8月19日,浙江衢州市
255,300258,精锻科技,江苏太平洋精锻科技股份有限公司,300258,精锻科技,2011年8月26日,江苏泰州市
256,300259,新天科技,新天科技股份有限公司,300259,新天科技,2011年8月31日,河南郑州市
257,300260,新莱应材,昆山新莱洁净应用材料股份有限公司,300260,新莱应材,2011年9月6日,江苏苏州市
258,300261,雅本化学,雅本化学股份有限公司,300261,雅本化学,2011年9月6日,江苏苏州市
259,300262,巴安水务,上海巴安水务股份有限公司,300262,巴安水务,2011年9月16日,上海市
260,300263,隆华节能,洛阳隆华传热节能股份有限公司,300263,隆华节能,2011年9月16日,河南洛阳市
261,300264,佳创视讯,深圳市佳创视讯技术股份有限公司,300264,佳创视讯,2011年9月16日,广东深圳市
262,300265,通光线缆,江苏通光电子线缆股份有限公司,300265,通光线缆,2011年9月16日,江苏南通市
263,300266,兴源环境,兴源环境科技股份有限公司,300266,兴源环境,2011年9月27日,浙江杭州市
264,300267,尔康制药,湖南尔康制药股份有限公司,300267,尔康制药,2011年9月27日,湖南长沙市
265,300268,万福生科,万福生科（湖南）农业开发股份有限公司,300268,万福生科,2011年9月27日,湖南常德市
266,300269,联建光电,深圳市联建光电股份有限公司,300269,联建光电,2011年10月12日,广东深圳市
267,300270,中威电子,杭州中威电子股份有限公司,300270,中威电子,2011年10月12日,浙江杭州市
268,300271,华宇软件,北京华宇软件股份有限公司,300271,华宇软件,2011年10月26日,北京市
269,300272,开能环保,上海开能环保设备股份有限公司,300272,开能环保,2011年11月2日,上海市
270,300273,和佳股份,珠海和佳医疗设备股份有限公司,300273,和佳股份,2011年10月26日,广东珠海市
271,300274,阳光电源,阳光电源股份有限公司,300274,阳光电源,2011年11月2日,安徽合肥市
272,300275,梅安森,重庆梅安森科技股份有限公司,300275,梅安森,2011年11月2日,重庆市
273,300276,三丰智能,湖北三丰智能输送装备股份有限公司,300276,三丰智能,2011年11月15日,湖北黄石市
274,300277,海联讯,深圳海联讯科技股份有限公司,300277,海联讯,2011年11月23日,广东深圳市
275,300278,华昌达,湖北华昌达智能装备股份有限公司,300278,华昌达,2011年12月16日,湖北十堰市
276,300279,和晶科技,无锡和晶科技股份有限公司,300279,和晶科技,2011年12月29日,江苏无锡市
277,300280,南通锻压,南通锻压设备股份有限公司,300280,南通锻压,2011年12月29日,江苏南通市
278,300281,金明精机,广东金明精机股份有限公司,300281,金明精机,2011年12月29日,广东汕头市
279,300282,汇冠股份,北京汇冠新技术股份有限公司,300282,汇冠股份,2011年12月29日,北京市
280,300283,温州宏丰,温州宏丰电工合金股份有限公司,300283,温州宏丰,2012年1月10日,浙江温州市
281,300284,苏交科,苏交科集团股份有限公司,300284,苏交科,2012年1月10日,江苏南京市
282,300285,国瓷材料,山东国瓷功能材料股份有限公司,300285,国瓷材料,2012年1月13日,山东东营市
283,300286,安科瑞,安科瑞电气股份有限公司,300286,安科瑞,2012年1月13日,上海市
284,300287,飞利信,北京飞利信科技股份有限公司,300287,飞利信,2012年2月1日,北京市
285,300288,朗玛信息,贵阳朗玛信息技术股份有限公司,300288,朗玛信息,2012年2月16日,贵州贵阳市
286,300289,利德曼,北京利德曼生化股份有限公司,300289,利德曼,2012年2月16日,北京市
287,300290,荣科科技,荣科科技股份有限公司,300290,荣科科技,2012年2月16日,辽宁沈阳市
288,300291,华录百纳,北京华录百纳影视股份有限公司,300291,华录百纳,2012年2月9日,北京市
289,300292,吴通控股,吴通控股集团股份有限公司,300292,吴通控股,2012年2月29日,江苏苏州市
290,300293,蓝英装备,沈阳蓝英工业自动化装备股份有限公司,300293,蓝英装备,2012年3月8日,辽宁沈阳市
291,300294,博雅生物,江西博雅生物制药股份有限公司,300294,博雅生物,2012年3月8日,江西抚州市
292,300295,三六五网,江苏三六五网络股份有限公司,300295,三六五网,2012年3月15日,江苏南京市
293,300296,利亚德,利亚德光电股份有限公司,300296,利亚德,2012年3月15日,北京市
294,300297,蓝盾股份,蓝盾信息安全技术股份有限公司,300297,蓝盾股份,2012年3月15日,广东广州市
295,300298,三诺生物,三诺生物传感股份有限公司,300298,三诺生物,2012年3月19日,湖南长沙市
296,300299,富春通信,富春通信股份有限公司,300299,富春通信,2012年3月19日,福建福州市
297,300300,汉鼎股份,汉鼎信息科技股份有限公司,300300,汉鼎股份,2012年3月19日,浙江杭州市
298,300301,长方集团,深圳市长方集团股份有限公司,300301,长方集团,2012年3月21日,广东深圳市
299,300302,同有科技,北京同有飞骥科技股份有限公司,300302,同有科技,2012年3月21日,北京市
300,300303,聚飞光电,深圳市聚飞光电股份有限公司,300303,聚飞光电,2012年3月19日,广东深圳市
301,300304,云意电气,江苏云意电气股份有限公司,300304,云意电气,2012年3月21日,江苏徐州市
302,300305,裕兴股份,江苏裕兴薄膜科技股份有限公司,300305,裕兴股份,2012年3月29日,江苏常州市
303,300306,远方光电,杭州远方光电信息股份有限公司,300306,远方光电,2012年3月29日,浙江杭州市
304,300307,慈星股份,宁波慈星股份有限公司,300307,慈星股份,2012年3月29日,浙江宁波市
305,300308,中际装备,山东中际电工装备股份有限公司,300308,中际装备,2012年4月10日,山东烟台市
306,300309,吉艾科技,吉艾科技（北京）股份公司,300309,吉艾科技,2012年4月10日,北京市
307,300310,宜通世纪,广东宜通世纪科技股份有限公司,300310,宜通世纪,2012年4月25日,广东广州市
308,300311,任子行,任子行网络技术股份有限公司,300311,任子行,2012年4月25日,广东深圳市
309,300312,邦讯技术,邦讯技术股份有限公司,300312,邦讯技术,2012年5月8日,北京市
310,300313,天山生物,新疆天山畜牧生物工程股份有限公司,300313,天山生物,2012年4月25日,新疆昌吉回族自治州
311,300314,戴维医疗,宁波戴维医疗器械股份有限公司,300314,戴维医疗,2012年5月8日,浙江宁波市
312,300315,掌趣科技,北京掌趣科技股份有限公司,300315,掌趣科技,2012年5月11日,北京市
313,300316,晶盛机电,浙江晶盛机电股份有限公司,300316,晶盛机电,2012年5月11日,浙江绍兴市
314,300317,珈伟股份,深圳珈伟光伏照明股份有限公司,300317,珈伟股份,2012年5月11日,广东深圳市
315,300318,博晖创新,北京博晖创新光电技术股份有限公司,300318,博晖创新,2012年5月23日,北京市
316,300319,麦捷科技,深圳市麦捷微电子科技股份有限公司,300319,麦捷科技,2012年5月23日,广东深圳市
317,300320,海达股份,江阴海达橡塑股份有限公司,300320,海达股份,2012年6月1日,江苏无锡市
318,300321,同大股份,山东同大海岛新材料股份有限公司,300321,同大股份,2012年5月23日,山东潍坊市
319,300322,硕贝德,惠州硕贝德无线科技股份有限公司,300322,硕贝德,2012年6月8日,广东惠州市
320,300323,华灿光电,华灿光电股份有限公司,300323,华灿光电,2012年6月1日,湖北武汉市
321,300324,旋极信息,北京旋极信息技术股份有限公司,300324,旋极信息,2012年6月8日,北京市
322,300325,德威新材,江苏德威新材料股份有限公司,300325,德威新材,2012年6月1日,江苏苏州市
323,300326,凯利泰,上海凯利泰医疗科技股份有限公司,300326,凯利泰,2012年6月13日,上海市
324,300327,中颖电子,中颖电子股份有限公司,300327,中颖电子,2012年6月13日,上海市
325,300328,宜安科技,东莞宜安科技股份有限公司,300328,宜安科技,2012年6月19日,广东东莞市
326,300329,海伦钢琴,海伦钢琴股份有限公司,300329,海伦钢琴,2012年6月19日,浙江宁波市
327,300330,华虹计通,上海华虹计通智能系统股份有限公司,300330,华虹计通,2012年6月19日,上海市
328,300331,苏大维格,苏州苏大维格光电科技股份有限公司,300331,苏大维格,2012年6月28日,江苏苏州市
329,300332,天壕环境,天壕环境股份有限公司,300332,天壕环境,2012年6月28日,北京市
330,300333,兆日科技,深圳兆日科技股份有限公司,300333,兆日科技,2012年6月28日,广东深圳市
331,300334,津膜科技,天津膜天膜科技股份有限公司,300334,津膜科技,2012年7月5日,天津市
332,300335,迪森股份,广州迪森热能技术股份有限公司,300335,迪森股份,2012年7月10日,广东广州市
333,300336,新文化,上海新文化传媒集团股份有限公司,300336,新文化,2012年7月10日,上海市
334,300337,银邦股份,银邦金属复合材料股份有限公司,300337,银邦股份,2012年7月18日,江苏无锡市
335,300338,开元仪器,长沙开元仪器股份有限公司,300338,开元仪器,2012年7月26日,湖南长沙市
336,300339,润和软件,江苏润和软件股份有限公司,300339,润和软件,2012年7月18日,江苏南京市
337,300340,科恒股份,江门市科恒实业股份有限公司,300340,科恒股份,2012年7月26日,广东江门市
338,300341,麦迪电气,麦克奥迪（厦门）电气股份有限公司,300341,麦迪电气,2012年7月26日,福建厦门市
339,300342,天银机电,常熟市天银机电股份有限公司,300342,天银机电,2012年7月26日,江苏苏州市
340,300343,联创股份,山东联创节能新材料股份有限公司,300343,联创股份,2012年8月1日,山东淄博市
341,300344,太空板业,北京太空板业股份有限公司,300344,太空板业,2012年8月1日,北京市
342,300345,红宇新材,湖南红宇耐磨新材料股份有限公司,300345,红宇新材,2012年8月1日,湖南长沙市
343,300346,南大光电,江苏南大光电材料股份有限公司,300346,南大光电,2012年8月7日,江苏苏州市
344,300347,泰格医药,杭州泰格医药科技股份有限公司,300347,泰格医药,2012年8月17日,浙江杭州市
345,300348,长亮科技,深圳市长亮科技股份有限公司,300348,长亮科技,2012年8月17日,广东深圳市
346,300349,金卡股份,金卡高科技股份有限公司,300349,金卡股份,2012年8月17日,浙江温州市
347,300350,华鹏飞,深圳市华鹏飞现代物流股份有限公司,300350,华鹏飞,2012年8月21日,广东深圳市
348,300351,永贵电器,浙江永贵电器股份有限公司,300351,永贵电器,2012年9月20日,浙江台州市
349,300352,北信源,北京北信源软件股份有限公司,300352,北信源,2012年9月12日,北京市
350,300353,东土科技,北京东土科技股份有限公司,300353,东土科技,2012年9月27日,北京市
351,300354,东华测试,江苏东华测试技术股份有限公司,300354,东华测试,2012年9月20日,江苏泰州市
352,300355,蒙草抗旱,内蒙古和信园蒙草抗旱绿化股份有限公司,300355,蒙草抗旱,2012年9月27日,内蒙古呼和浩特市
353,300356,光一科技,光一科技股份有限公司,300356,光一科技,2012年10月9日,江苏南京市
354,300357,我武生物,浙江我武生物科技股份有限公司,300357,我武生物,2014年1月21日,浙江湖州市
355,300358,楚天科技,楚天科技股份有限公司,300358,楚天科技,2014年1月21日,湖南长沙市
356,300359,全通教育,广东全通教育股份有限公司,300359,全通教育,2014年1月21日,广东中山市
357,300360,炬华科技,杭州炬华科技股份有限公司,300360,炬华科技,2014年1月21日,浙江杭州市
358,300362,天翔环境,成都天翔环境股份有限公司,300362,天翔环境,2014年1月21日,四川成都市
359,300363,博腾股份,重庆博腾制药科技股份有限公司,300363,博腾股份,2014年1月29日,重庆市
360,300364,中文在线,中文在线数字出版集团股份有限公司,300364,中文在线,2015年1月21日,北京市
361,300365,恒华科技,北京恒华伟业科技股份有限公司,300365,恒华科技,2014年1月23日,北京市
362,300366,创意信息,四川创意信息技术股份有限公司,300366,创意信息,2014年1月27日,四川成都市
363,300367,东方网力,东方网力科技股份有限公司,300367,东方网力,2014年1月29日,北京市
364,300368,汇金股份,河北汇金机电股份有限公司,300368,汇金股份,2014年1月23日,河北石家庄市
365,300369,绿盟科技,北京神州绿盟信息安全科技股份有限公司,300369,绿盟科技,2014年1月29日,北京市
366,300370,安控科技,北京安控科技股份有限公司,300370,安控科技,2014年1月23日,北京市
367,300371,汇中股份,汇中仪表股份有限公司,300371,汇中股份,2014年1月23日,河北唐山市
368,300372,欣泰电气,丹东欣泰电气股份有限公司,300372,欣泰电气,2014年1月27日,辽宁丹东市
369,300373,扬杰科技,扬州扬杰电子科技股份有限公司,300373,扬杰科技,2014年1月23日,江苏扬州市
370,300374,恒通科技,北京恒通创新赛木科技股份有限公司,300374,恒通科技,2015年3月19日,北京市
371,300375,鹏翎股份,天津鹏翎胶管股份有限公司,300375,鹏翎股份,2014年1月27日,天津市
372,300376,易事特,易事特集团股份有限公司,300376,易事特,2014年1月27日,广东东莞市
373,300377,赢时胜,深圳市赢时胜信息技术股份有限公司,300377,赢时胜,2014年1月27日,广东深圳市
374,300378,鼎捷软件,鼎捷软件股份有限公司,300378,鼎捷软件,2014年1月27日,上海市
375,300379,东方通,北京东方通科技股份有限公司,300379,东方通,2014年1月28日,北京市
376,300380,安硕信息,上海安硕信息技术股份有限公司,300380,安硕信息,2014年1月28日,上海市
377,300381,溢多利,广东溢多利生物科技股份有限公司,300381,溢多利,2014年1月28日,广东珠海市
378,300382,斯莱克,苏州斯莱克精密设备股份有限公司,300382,斯莱克,2014年1月29日,江苏苏州市
379,300383,光环新网,北京光环新网科技股份有限公司,300383,光环新网,2014年1月29日,北京市
380,300384,三联虹普,北京三联虹普新合纤技术服务股份有限公司,300384,三联虹普,2014年8月1日,北京市
381,300385,雪浪环境,无锡雪浪环境科技股份有限公司,300385,雪浪环境,2014年6月26日,江苏无锡市
382,300386,飞天诚信,飞天诚信科技股份有限公司,300386,飞天诚信,2014年6月26日,北京市
383,300387,富邦股份,湖北富邦科技股份有限公司,300387,富邦股份,2014年7月2日,湖北孝感市
384,300388,国祯环保,安徽国祯环保节能科技股份有限公司,300388,国祯环保,2014年8月1日,安徽合肥市
385,300389,艾比森,深圳市艾比森光电股份有限公司,300389,艾比森,2014年8月1日,广东深圳市
386,300390,天华超净,苏州天华超净科技股份有限公司,300390,天华超净,2014年7月31日,江苏苏州市
387,300391,康跃科技,康跃科技股份有限公司,300391,康跃科技,2014年8月1日,山东潍坊市
388,300392,腾信股份,北京腾信创新网络营销技术股份有限公司,300392,腾信股份,2014年9月10日,北京市
389,300393,中来股份,苏州中来光伏新材股份有限公司,300393,中来股份,2014年9月12日,江苏苏州市
390,300394,天孚通信,苏州天孚光通信股份有限公司,300394,天孚通信,2015年2月17日,江苏苏州市
391,300395,菲利华,湖北菲利华石英玻璃股份有限公司,300395,菲利华,2014年9月10日,湖北荆州市
392,300396,迪瑞医疗,长春迪瑞医疗科技股份有限公司,300396,迪瑞医疗,2014年9月10日,吉林长春市
393,300397,天和防务,西安天和防务技术股份有限公司,300397,天和防务,2014年9月10日,陕西西安市
394,300398,飞凯材料,上海飞凯光电材料股份有限公司,300398,飞凯材料,2014年10月9日,上海市
395,300399,京天利,北京无线天利移动信息技术股份有限公司,300399,京天利,2014年10月9日,北京市
396,300400,劲拓股份,深圳市劲拓自动化设备股份有限公司,300400,劲拓股份,2014年10月10日,广东深圳市
397,300401,花园生物,浙江花园生物高科股份有限公司,300401,花园生物,2014年10月9日,浙江金华市
398,300402,宝色股份,南京宝色股份公司,300402,宝色股份,2014年10月10日,江苏南京市
399,300403,地尔汉宇,江门市地尔汉宇电器股份有限公司,300403,地尔汉宇,2014年10月30日,广东江门市
400,300404,博济医药,广州博济医药生物技术股份有限公司,300404,博济医药,2015年4月24日,广东广州市
401,300405,科隆精化,辽宁科隆精细化工股份有限公司,300405,科隆精化,2014年10月30日,辽宁辽阳市
402,300406,九强生物,北京九强生物技术股份有限公司,300406,九强生物,2014年10月30日,北京市
403,300407,凯发电气,天津凯发电气股份有限公司,300407,凯发电气,2014年12月3日,天津市
404,300408,三环集团,潮州三环（集团）股份有限公司,300408,三环集团,2014年12月3日,广东潮州市
405,300409,道氏技术,广东道氏技术股份有限公司,300409,道氏技术,2014年12月3日,广东江门市
406,300410,正业科技,广东正业科技股份有限公司,300410,正业科技,2014年12月31日,广东东莞市
407,300411,金盾股份,浙江金盾风机股份有限公司,300411,金盾股份,2014年12月31日,浙江绍兴市
408,300412,迦南科技,浙江迦南科技股份有限公司,300412,迦南科技,2014年12月31日,浙江温州市
409,300413,快乐购,快乐购物股份有限公司,300413,快乐购,2015年1月21日,湖南长沙市
410,300414,中光防雷,四川中光防雷科技股份有限公司,300414,中光防雷,2015年5月13日,四川成都市
411,300415,伊之密,广东伊之密精密机械股份有限公司,300415,伊之密,2015年1月23日,广东佛山市
412,300416,苏试试验,苏州苏试试验仪器股份有限公司,300416,苏试试验,2015年1月22日,江苏苏州市
413,300417,南华仪器,佛山市南华仪器股份有限公司,300417,南华仪器,2015年1月23日,广东佛山市
414,300418,昆仑万维,北京昆仑万维科技股份有限公司,300418,昆仑万维,2015年1月21日,北京市
415,300419,浩丰科技,北京浩丰创源科技股份有限公司,300419,浩丰科技,2015年1月22日,北京市
416,300420,五洋科技,徐州五洋科技股份有限公司,300420,五洋科技,2015年2月17日,江苏徐州市
417,300421,力星股份,江苏力星通用钢球股份有限公司,300421,力星股份,2015年2月17日,江苏南通市
418,300422,博世科,广西博世科环保科技股份有限公司,300422,博世科,2015年2月17日,广西南宁市
419,300423,鲁亿通,山东鲁亿通智能电气股份有限公司,300423,鲁亿通,2015年2月17日,山东烟台市
420,300424,航新科技,广州航新航空科技股份有限公司,300424,航新科技,2015年4月22日,广东广州市
421,300425,环能科技,四川环能德美科技股份有限公司,300425,环能科技,2015年2月16日,四川成都市
422,300426,唐德影视,浙江唐德影视股份有限公司,300426,唐德影视,2015年2月17日,浙江金华市
423,300427,红相电力,厦门红相电力设备股份有限公司,300427,红相电力,2015年2月17日,福建厦门市
424,300428,四通新材,河北四通新型金属材料股份有限公司,300428,四通新材,2015年3月19日,河北保定市
425,300429,强力新材,常州强力电子新材料股份有限公司,300429,强力新材,2015年3月24日,江苏常州市
426,300430,诚益通,北京诚益通控制工程科技股份有限公司,300430,诚益通,2015年3月19日,北京市
427,300431,暴风科技,北京暴风科技股份有限公司,300431,暴风科技,2015年3月24日,北京市
428,300432,富临精工,绵阳富临精工机械股份有限公司,300432,富临精工,2015年3月19日,四川绵阳市
429,300433,蓝思科技,蓝思科技股份有限公司,300433,蓝思科技,2015年3月18日,湖南长沙市
430,300434,金石东方,四川金石东方新材料设备股份有限公司,300434,金石东方,2015年4月24日,四川成都市
431,300435,中泰股份,杭州中泰深冷技术股份有限公司,300435,中泰股份,2015年3月26日,浙江杭州市
432,300436,广生堂,福建广生堂药业股份有限公司,300436,广生堂,2015年4月22日,福建宁德市
433,300437,清水源,河南清水源科技股份有限公司,300437,清水源,2015年4月23日,河南济源市
434,300438,鹏辉能源,广州鹏辉能源科技股份有限公司,300438,鹏辉能源,2015年4月24日,广东广州市
435,300439,美康生物,宁波美康生物科技股份有限公司,300439,美康生物,2015年4月22日,浙江宁波市
436,300440,运达科技,成都运达科技股份有限公司,300440,运达科技,2015年4月23日,四川成都市
437,300441,鲍斯股份,宁波鲍斯能源装备股份有限公司,300441,鲍斯股份,2015年4月23日,浙江宁波市
438,300442,普丽盛,上海普丽盛包装股份有限公司,300442,普丽盛,2015年4月24日,上海市
439,300443,金雷风电,山东莱芜金雷风电科技股份有限公司,300443,金雷风电,2015年4月22日,山东莱芜市
440,300444,双杰电气,北京双杰电气股份有限公司,300444,双杰电气,2015年4月23日,北京市
441,300445,康斯特,北京康斯特仪表科技股份有限公司,300445,康斯特,2015年4月24日,北京市
442,300446,乐凯新材,保定乐凯新材料股份有限公司,300446,乐凯新材,2015年4月23日,河北保定市
443,300447,全信股份,南京全信传输科技股份有限公司,300447,全信股份,2015年4月22日,江苏南京市
444,300448,浩云科技,广州市浩云安防科技股份有限公司,300448,浩云科技,2015年4月24日,广东广州市
445,300449,汉邦高科,北京汉邦高科数字技术股份有限公司,300449,汉邦高科,2015年4月22日,北京市
446,300450,先导智能,无锡先导智能装备股份有限公司,300450,先导智能,2015年5月18日,江苏无锡市
447,300451,创业软件,创业软件股份有限公司,300451,创业软件,2015年5月14日,浙江杭州市
